{
  "$schema": "https://hivellm.org/schemas/classify-template-tiny-v1.json",
  "version": "1.0",
  
  "metadata": {
    "name": "marketing",
    "display_name": "Marketing (Tiny)",
    "description": "Lightweight template for marketing documents",
    "domains": ["marketing", "advertising"],
    "priority": 82
  },
  
  "llm_config": {
    "provider": "deepseek",
    "model": "deepseek-chat",
    "temperature": 0.0,
    "max_tokens": 400,
    "system_prompt": "Extract title, campaign, and channel. Minimal."
  },
  
  "entity_definitions": [
    {
      "type": "Document",
      "properties": {
        "title": { "type": "string", "required": true },
        "campaign": { "type": "string", "required": false }
      }
    },
    {
      "type": "Channel",
      "properties": {
        "name": { "type": "string", "required": true }
      }
    }
  ],
  
  "relationship_definitions": [
    {
      "type": "USES_CHANNEL",
      "source": "Document",
      "target": "Channel"
    }
  ],
  
  "graph_schema": {
    "nodes": [
      {
        "type": "Document",
        "labels": ["Document", "Marketing"],
        "required_properties": ["id", "title"],
        "indexes": [
          { "property": "id", "type": "unique" }
        ]
      },
      {
        "type": "Channel",
        "labels": ["Channel"],
        "required_properties": ["name"],
        "indexes": [
          { "property": "name", "type": "index" }
        ]
      }
    ],
    "relationships": [
      {
        "type": "USES_CHANNEL",
        "source": "Document",
        "target": "Channel"
      }
    ]
  },
  
  "fulltext_schema": {
    "required_fields": ["title", "domain", "doc_type"],
    
    "extracted_fields": [
      {
        "name": "campaign",
        "type": "string",
        "extraction_method": "llm",
        "index": true
      }
    ],
    
    "keyword_extraction": {
      "enabled": true,
      "method": "tfidf",
      "min_frequency": 3,
      "max_keywords": 6
    },
    
    "summary": {
      "enabled": true,
      "method": "llm",
      "max_length": 80
    }
  },
  
  "extraction_rules": [
    {
      "name": "extract_marketing",
      "method": "llm",
      "prompt": "Extract campaign and channel"
    }
  ],
  
  "validation_rules": [
    {
      "field": "title",
      "rules": [
        { "type": "required" },
        { "type": "max_length", "value": 150 }
      ]
    }
  ]
}

